{"$defs":{"finding":{"additionalProperties":false,"properties":{"local_id":{"maxLength":4096,"minLength":1,"type":"string"},"locations":{"items":{"$ref":"#/$defs/location"},"maxItems":16,"minItems":1,"type":"array"},"mechanism_tags":{"items":{"$ref":"#/$defs/mechanism"},"maxItems":8,"minItems":1,"type":"array","uniqueItems":true},"rationale":{"maxLength":16384,"type":"string"},"severity":{"enum":["critical","high","medium","low"]}},"required":["local_id","locations","mechanism_tags"],"type":"object"},"location":{"additionalProperties":false,"properties":{"end_line":{"maximum":1000000,"minimum":1,"type":"integer"},"path":{"maxLength":4096,"minLength":1,"pattern":"^(?!/)(?!.*(?:^|/)\\.\\.?/)(?!.*//).+$","type":"string"},"start_line":{"maximum":1000000,"minimum":1,"type":"integer"}},"required":["path","start_line","end_line"],"type":"object"},"mechanism":{"enum":["check_write_gap","cross_file_contract","cross_file_effect","repeatable_entry","repeated_effect","state_transition_gap","unstable_scope_key","unstable_token"]},"obligation":{"additionalProperties":false,"allOf":[{"else":{"properties":{"finding_local_ids":{"maxItems":0}}},"if":{"properties":{"disposition":{"const":"issue_present"}},"required":["disposition"]},"then":{"properties":{"finding_local_ids":{"minItems":1}}}}],"properties":{"disposition":{"enum":["issue_present","issue_absent","inconclusive","not_applicable","abstained"]},"finding_local_ids":{"items":{"maxLength":4096,"minLength":1,"type":"string"},"type":"array","uniqueItems":true},"packet_id":{"maxLength":4096,"minLength":1,"type":"string"}},"required":["packet_id","disposition","finding_local_ids"],"type":"object"}},"$id":"https://capht.tech/schemas/reviewgraphen/benchmark/candidate-output.v1","$schema":"https://json-schema.org/draft/2020-12/schema","additionalProperties":false,"allOf":[{"if":{"properties":{"outcome":{"enum":["abstained","parse_failure"]}},"required":["outcome"]},"then":{"properties":{"findings":{"maxItems":0},"obligation_results":{"maxItems":0}}}}],"properties":{"findings":{"items":{"$ref":"#/$defs/finding"},"maxItems":1024,"type":"array"},"obligation_results":{"items":{"$ref":"#/$defs/obligation"},"maxItems":4096,"type":"array"},"outcome":{"enum":["structured","abstained","parse_failure"]},"schema":{"const":"reviewgraphen.benchmark.candidate_output.v1"},"trial_id":{"maxLength":4096,"minLength":1,"type":"string"}},"required":["schema","trial_id","outcome","findings","obligation_results"],"type":"object"}
