{"schema":"reviewgraphen.benchmark.candidate_output.v1","trial_id":"m7-real:snapshot-32:g3_proxy:1","outcome":"structured","findings":[{"local_id":"ignored-abstract-step-violation","locations":[{"path":"rust/fsl-runtime/src/lib.rs","start_line":1889,"end_line":1890},{"path":"rust/fsl-runtime/src/lib.rs","start_line":1055,"end_line":1094}],"mechanism_tags":["state_transition_gap","cross_file_contract"],"severity":"high","rationale":"Monitor::step reports invariant, transition, ensures, and partial-operation failures through StepResult.violation while retaining the pre-transition state. check_refinement ignores abs_step.violation and compares only abs_step.state with alpha_after. Consequently, a mapped abstract action that is semantically invalid can be accepted whenever the implementation's abstraction equals that retained state, producing a false successful refinement result."}],"obligation_results":[{"packet_id":"benchmark-context:sha256:4fd184a3764e867a1ed0aa51a6fcbf5c3046eb6ed0e9dd37059ac1cc0e7a367b","disposition":"not_applicable","finding_local_ids":[]},{"packet_id":"benchmark-context:sha256:9cfa4bcf5202fac062cb1e64a967e087ccfb17e34551a7e3f42e9eb9695d5e4c","disposition":"not_applicable","finding_local_ids":[]},{"packet_id":"benchmark-context:sha256:e977994a87c3d8ba45ba95146e9e6cf4c5ffa34a45d2455c490c927c82c5661f","disposition":"issue_present","finding_local_ids":["ignored-abstract-step-violation"]},{"packet_id":"benchmark-context:sha256:ed54ef14682b749280f1d2754639a4e961310ccdf43245706ba64a300b3b4628","disposition":"issue_present","finding_local_ids":["ignored-abstract-step-violation"]},{"packet_id":"benchmark-context:sha256:faa0e2ea84e764ad328168ed65de3ad0be121c50d33a2a0fc0823e32938b719e","disposition":"not_applicable","finding_local_ids":[]}]}