{"schema":"reviewgraphen.benchmark.candidate_output.v1","trial_id":"m7-real:snapshot-33:g3_proxy:1","outcome":"structured","findings":[{"local_id":"unverified-signed-approvals","locations":[{"path":"rust/fslc/src/main.rs","start_line":1973,"end_line":2010},{"path":"rust/fslc/src/main.rs","start_line":2635,"end_line":2668},{"path":"rust/fslc/src/main.rs","start_line":2744,"end_line":2765}],"mechanism_tags":["cross_file_contract"],"rationale":"The document-generation path verifies every signed approval against a TrustStore, but `document check` exposes no trust-key option and `load_approvals_for_check` merely parses V2 records and copies their key IDs. A forged or untrusted signed record can therefore be incorporated into the expected rendering and reported as `document_conformant`, falsely presenting stakeholder approval as valid.","severity":"high"},{"local_id":"partial-init-refinement-underapproximation","locations":[{"path":"rust/fsl-runtime/src/explicit.rs","start_line":389,"end_line":411},{"path":"rust/fsl-runtime/src/lib.rs","start_line":1507,"end_line":1539},{"path":"rust/fsl-runtime/src/lib.rs","start_line":1554,"end_line":1591}],"mechanism_tags":["check_write_gap","state_transition_gap"],"rationale":"`unassigned_init_state_vars` marks an entire state root assigned when any component is written in any branch. `concrete_initial_states` then enumerates only wholly absent roots, default-initializing untouched map keys, struct fields, or conditionally unwritten values. Since `check_refinement` relies on this set for implementation and abstraction initial states, legal nondeterministic initial states can be omitted and an invalid refinement can pass.","severity":"high"},{"local_id":"migration-lost-update","locations":[{"path":"rust/fslc/src/main.rs","start_line":636,"end_line":681},{"path":"rust/fslc/src/main.rs","start_line":842,"end_line":898}],"mechanism_tags":["check_write_gap","repeatable_entry"],"rationale":"Migration plans and validates content read before `atomic_write_migrations`, but the write phase never verifies that each target still contains those bytes. A concurrent editor or migration can change a file after planning; the later rename silently overwrites that newer content. Backups are created only at commit time and are deleted on success, so they do not prevent or recover this lost update.","severity":"medium"},{"local_id":"struct-field-init-key-collision","locations":[{"path":"rust/fsl-runtime/src/explicit.rs","start_line":621,"end_line":650},{"path":"rust/fsl-runtime/src/explicit.rs","start_line":673,"end_line":695},{"path":"rust/fsl-runtime/src/explicit.rs","start_line":924,"end_line":941}],"mechanism_tags":["unstable_scope_key","check_write_gap"],"rationale":"Although coverage tracking can merge assignments to separate struct fields, `init_write_key` collapses every field target to the root variable. After `s.a` is assigned, a subsequent disjoint `s.b` assignment is therefore reported as assigning `s` twice. Valid deterministic field-by-field initialization is rejected by the explicit engine and forces `auto` verification to fall back unnecessarily.","severity":"medium"}],"obligation_results":[{"packet_id":"benchmark-context:sha256:195e18b566799d97d6465c226a9644cd3dacff60958f0d4f43db41ff140bd74a","disposition":"issue_present","finding_local_ids":["migration-lost-update"]},{"packet_id":"benchmark-context:sha256:3142a66f250660e41f5f36a3a47f8364233fe0f46249844c83cec5cb5fe5190f","disposition":"issue_present","finding_local_ids":["unverified-signed-approvals","partial-init-refinement-underapproximation"]},{"packet_id":"benchmark-context:sha256:303fa93928c1023bec28232f13cd8a34f8cc278a8afa12bb7ab35889ec357a93","disposition":"issue_present","finding_local_ids":["migration-lost-update","struct-field-init-key-collision"]},{"packet_id":"benchmark-context:sha256:2af4b327604321a47685b5c4a3e8f0322a0b404e24046f429c8f86c1589363da","disposition":"issue_present","finding_local_ids":["migration-lost-update"]},{"packet_id":"benchmark-context:sha256:1040be6b2ce362af5aff2e166f7e64d52488d40b883d72ddf862d3e309222c96","disposition":"not_applicable","finding_local_ids":[]}]}