{"findings":[{"local_id":"effect-reentry-bypasses-retry-limit","locations":[{"end_line":1128,"path":"rust/fsl-core/src/domain.rs","start_line":1083},{"end_line":2436,"path":"rust/fsl-core/src/domain_lowering.rs","start_line":2384},{"end_line":2599,"path":"rust/fsl-core/src/domain_lowering.rs","start_line":2549}],"mechanism_tags":["repeatable_entry","repeated_effect","state_transition_gap"],"rationale":"Request actions reject only Pending and Succeeded. After Failed or TimedOut, the original command can be invoked again for the same correlation and resets attempts to 1, bypassing the retry action's max-attempts guard indefinitely.","severity":"high"},{"local_id":"effect-idempotency-key-has-no-semantics","locations":[{"end_line":1940,"path":"rust/fsl-core/src/domain_lowering.rs","start_line":1936},{"end_line":2436,"path":"rust/fsl-core/src/domain_lowering.rs","start_line":2384}],"mechanism_tags":["check_write_gap","repeated_effect","unstable_token"],"rationale":"idempotency_key is only path-validated; no state, guard, lookup, or write derived from it is generated. Effect admission is keyed solely by correlation, so the declared idempotency contract cannot suppress duplicate effects.","severity":"high"},{"local_id":"emitting-saga-step-ignores-awaits","locations":[{"end_line":759,"path":"rust/fsl-core/src/domain.rs","start_line":730},{"end_line":2666,"path":"rust/fsl-core/src/domain_lowering.rs","start_line":2633}],"mechanism_tags":["check_write_gap","repeatable_entry","repeated_effect"],"rationale":"Await guards are generated only when step.emits is empty. A normal wait-then-emit step therefore becomes enabled without any awaited event and may emit prematurely or repeatedly.","severity":"high"},{"local_id":"compensation-history-cleared-between-events","locations":[{"end_line":561,"path":"rust/fsl-core/src/domain.rs","start_line":540},{"end_line":858,"path":"rust/fsl-core/src/domain.rs","start_line":838},{"end_line":1968,"path":"rust/fsl-core/src/domain_lowering.rs","start_line":1945},{"end_line":2770,"path":"rust/fsl-core/src/domain_lowering.rs","start_line":2757}],"mechanism_tags":["state_transition_gap","unstable_token","cross_file_effect"],"rationale":"Every action rewrites all event flags to represent only that action's emissions, while compensation requires trigger_event and after_event flags simultaneously. When those events occur sequentially, observing the latter clears the former, making the compensation unreachable unless one action emits both.","severity":"high"},{"local_id":"correlation-contract-diverges-between-lowering-paths","locations":[{"end_line":317,"path":"rust/fsl-core/src/domain.rs","start_line":280},{"end_line":623,"path":"rust/fsl-core/src/domain.rs","start_line":617},{"end_line":1767,"path":"rust/fsl-core/src/domain_lowering.rs","start_line":1736}],"mechanism_tags":["cross_file_contract","unstable_scope_key"],"rationale":"The text renderer extracts only the final field name and obtains its type from handles/request_event, returning None and silently omitting lifecycle state/actions when resolution fails. Direct lowering instead resolves the actual Event.field receiver and errors on malformed or missing correlation, so identical input can produce different key types or lose the effect entirely depending on the lowering path.","severity":"medium"}],"obligation_results":[],"outcome":"structured","schema":"reviewgraphen.benchmark.candidate_output.v1","trial_id":"m7-real:snapshot-04:b1:1"}