{"findings":[{"local_id":"literate_materialization_can_clobber_files","locations":[{"end_line":76,"path":"rust/fslc/src/main.rs","start_line":55}],"mechanism_tags":["unstable_token","check_write_gap","repeated_effect"],"rationale":"The temporary filename is derived only from the Markdown stem and process ID, then opened with truncating std::fs::write. A pre-existing file or symlink with that predictable name is overwritten and subsequently deleted by Drop, causing data loss or an attacker-directed write.","severity":"high"},{"local_id":"migration_write_loses_concurrent_edits","locations":[{"end_line":694,"path":"rust/fslc/src/main.rs","start_line":648},{"end_line":960,"path":"rust/fslc/src/main.rs","start_line":910}],"mechanism_tags":["check_write_gap","cross_file_effect"],"rationale":"Migration replacements are computed from earlier file contents, but the commit phase verifies only that each destination is a regular file. It never checks that the destination still matches the source that was planned, so an intervening edit is silently overwritten.","severity":"high"},{"local_id":"verify_cache_omits_imports_outside_source_directory","locations":[{"end_line":1370,"path":"rust/fslc/src/verification.rs","start_line":1341},{"end_line":1482,"path":"rust/fslc/src/verification.rs","start_line":1434}],"mechanism_tags":["cross_file_contract","unstable_scope_key"],"rationale":"The cache key hashes FSL files found beneath the primary source's parent directory rather than the actual resolver dependency graph. A valid import resolved through a parent or other external path can change without changing the key, allowing a stale verification verdict to be reused.","severity":"high"},{"local_id":"verify_cache_key_can_describe_different_snapshot_than_result","locations":[{"end_line":1502,"path":"rust/fslc/src/verification.rs","start_line":1434},{"end_line":1728,"path":"rust/fslc/src/verification.rs","start_line":1672},{"end_line":2196,"path":"rust/fslc/src/verification.rs","start_line":2141}],"mechanism_tags":["check_write_gap","unstable_token"],"rationale":"The model is loaded before cache-key files are read, and auto-mode can recompute its key after verification. If the spec or a dependency changes between those operations, a result for one snapshot can be stored under the digest of another, persistently poisoning later cache hits.","severity":"high"},{"local_id":"approval_digest_and_record_are_read_from_different_snapshots","locations":[{"end_line":2399,"path":"rust/fslc/src/main.rs","start_line":2351},{"end_line":2764,"path":"rust/fslc/src/main.rs","start_line":2729}],"mechanism_tags":["check_write_gap","unstable_token"],"rationale":"Both approval loaders hash bytes from one read and then call read_versioned_record(path), which reads the path again. A concurrent replacement can make the combined digest describe one record while the parsed, verified, and rendered approval comes from another.","severity":"high"},{"local_id":"document_check_accepts_unverified_signed_approvals","locations":[{"end_line":2764,"path":"rust/fslc/src/main.rs","start_line":2729},{"end_line":2867,"path":"rust/fslc/src/main.rs","start_line":2773}],"mechanism_tags":["cross_file_contract","state_transition_gap"],"rationale":"The document-check path converts V2 signed records into applied approvals and exposes their key IDs without loading trust keys or verifying signatures. A forged signed approval can therefore be incorporated into the expected rendering and produce document_conformant.","severity":"high"},{"local_id":"invalid_approval_is_still_applied_to_ledger","locations":[{"end_line":11072,"path":"rust/fslc/src/main.rs","start_line":11045},{"end_line":11159,"path":"rust/fslc/src/main.rs","start_line":11138},{"end_line":11223,"path":"rust/fslc/src/main.rs","start_line":11190}],"mechanism_tags":["state_transition_gap","cross_file_effect"],"rationale":"Signature failure is returned as an ordinary evaluation object. approval_overlay does not reject that status and copies its claimed requirements into the ledger overlay; run_ledger_report then bases its exit status only on verification. A report can thus present requirements from an invalid approval while succeeding.","severity":"high"},{"local_id":"approval_check_reports_drift_as_success","locations":[{"end_line":11135,"path":"rust/fslc/src/main.rs","start_line":11119}],"mechanism_tags":["state_transition_gap","cross_file_effect"],"rationale":"The approval-check exit code is nonzero only for signature-invalid. Other negative evaluation states, including spec, artifact, claim-set, generator, or reviewed-artifact drift, are returned with status 0, so CI treating the command as a check accepts stale approvals.","severity":"high"},{"local_id":"approval_input_paths_depend_on_invocation_cwd","locations":[{"end_line":10690,"path":"rust/fslc/src/main.rs","start_line":10656},{"end_line":10729,"path":"rust/fslc/src/main.rs","start_line":10705}],"mechanism_tags":["unstable_scope_key","cross_file_contract"],"rationale":"Glossary and evidence paths are stored exactly as supplied and later reconstructed directly with PathBuf::from. Relative paths are therefore resolved against the approval-check process's current directory rather than the spec or record location, making the signed generation contract select different files across invocations.","severity":"medium"},{"local_id":"ai_dataset_source_uses_process_cwd","locations":[{"end_line":6454,"path":"rust/fslc/src/main.rs","start_line":6412}],"mechanism_tags":["unstable_scope_key","cross_file_contract"],"rationale":"A local dataset source declared in an AI project is converted directly to PathBuf without joining it to the project file's parent. Running the same evaluation from another directory reads a different file or fails, despite an unchanged project.","severity":"medium"},{"local_id":"reports_mix_independent_spec_snapshots","locations":[{"end_line":10635,"path":"rust/fslc/src/main.rs","start_line":10604},{"end_line":11278,"path":"rust/fslc/src/main.rs","start_line":11234}],"mechanism_tags":["cross_file_contract","check_write_gap"],"rationale":"HTML and ledger preparation independently reload the model, source, verification, explanation/replay, and scenarios from the same path. If the spec or its imports change during generation, one successful artifact can combine declarations and verdicts produced from different snapshots.","severity":"high"},{"local_id":"approval_create_can_bind_mismatched_spec_snapshots","locations":[{"end_line":10872,"path":"rust/fslc/src/main.rs","start_line":10845},{"end_line":10958,"path":"rust/fslc/src/main.rs","start_line":10917}],"mechanism_tags":["check_write_gap","unstable_token","cross_file_contract"],"rationale":"Approval creation separately loads the model, obtains Git binding, computes the spec digest, and regenerates the target. Concurrent source changes can make the recorded digest, target artifact, and approved requirement set originate from different versions while still emitting a signed record.","severity":"high"}],"obligation_results":[],"outcome":"structured","schema":"reviewgraphen.benchmark.candidate_output.v1","trial_id":"m7-real:snapshot-17:b1:1"}