{"schema":"reviewgraphen.benchmark.candidate_output.v1","trial_id":"m7-real:snapshot-21:full_review_graphen:1","outcome":"structured","findings":[{"local_id":"raw-block-declarations-silently-dropped","locations":[{"path":"rust/fsl-syntax/src/ai_project.rs","start_line":18,"end_line":53},{"path":"rust/fsl-syntax/src/ai_project.rs","start_line":295,"end_line":326}],"mechanism_tags":["cross_file_contract","state_transition_gap"],"severity":"medium","rationale":"The recognized project-block contract names evaluator and failure_mode as raw block boundaries, but RAW_BLOCKS omits both. parse_ai_project therefore recognizes their boundaries and then silently discards them through the fallback match arm, so downstream consumers receive an AiProject inconsistent with the declared parser contract."},{"local_id":"predictable-literate-path-clobber","locations":[{"path":"rust/fslc/src/main.rs","start_line":49,"end_line":52},{"path":"rust/fslc/src/main.rs","start_line":55,"end_line":80}],"mechanism_tags":["unstable_token","check_write_gap","cross_file_effect"],"severity":"high","rationale":"Markdown materialization derives a predictable sibling pathname solely from the source stem and process ID, then uses std::fs::write without exclusive creation. A pre-existing file or symlink at that path is followed and truncated, and Drop subsequently removes the pathname, enabling unintended cross-file corruption or deletion under PID reuse or a concurrent race."}],"obligation_results":[{"packet_id":"context-envelope:sha256:04b0777103512f7e4dcc7d09d3cbefd30898c89c5ebbe6a49259f663302971f3","disposition":"issue_present","finding_local_ids":["raw-block-declarations-silently-dropped"]},{"packet_id":"context-envelope:sha256:071828a6c072d77e7b6673d40155bf112adba7b110b13083350d468ca891b03b","disposition":"issue_present","finding_local_ids":["predictable-literate-path-clobber"]},{"packet_id":"context-envelope:sha256:61ae177d1d7f46a3bb937ee736db2ce9e35d6a955b7a4ff3b764ad249d352402","disposition":"issue_present","finding_local_ids":["predictable-literate-path-clobber"]},{"packet_id":"context-envelope:sha256:76599c3d48f8d26d6e1d84fbcd8690554a6ed9167a134477588eab7f4b72ba01","disposition":"inconclusive","finding_local_ids":[]},{"packet_id":"context-envelope:sha256:896695279313b91f0c8575839742635f8492fb34d7cb1b677a867495b7fa8168","disposition":"inconclusive","finding_local_ids":[]}]}