{"schema":"reviewgraphen.benchmark.candidate_output.v1","trial_id":"m7-real:snapshot-06:full_review_graphen:3","outcome":"structured","findings":[],"obligation_results":[{"packet_id":"context-envelope:sha256:23c59bf4e3ee6fd3c0d6794fa71254c916e6f9be6269ec19ba1e7650a1eedc85","disposition":"abstained","finding_local_ids":[]},{"packet_id":"context-envelope:sha256:3537868a8237b124e829448765c2abae4c33ffd651f612dcf2cd7e6df847d3a1","disposition":"inconclusive","finding_local_ids":[]},{"packet_id":"context-envelope:sha256:52bad0e48d92fcdb33b1b3344a14305a180571ccb3806ae5be10d3d11f04ac7f","disposition":"inconclusive","finding_local_ids":[]},{"packet_id":"context-envelope:sha256:53b672a4dbb9b6110d25e20b0a6579203d78aa75630f0214874256cc6f8deced","disposition":"inconclusive","finding_local_ids":[]},{"packet_id":"context-envelope:sha256:c04d5259727395e7db864c2e87b5253671760594b4a30977e0497410c485ff86","disposition":"inconclusive","finding_local_ids":[]}]}